[
  {
    "company": "1X",
    "robot": "NEO",
    "website": "https://www.1x.tech/neo",
    "x": "https://x.com/1x_tech",
    "linkedin": "",
    "youtube": "https://youtu.be/bUrLuUxv9gE",
    "country": "Norway",
    "careers": "",
    "b2b_client": "",
    "stock": "Private",
    "valuation": "",
    "investors": "OpenAI, Samsung, EQT, Tiger",
    "rounds": "125,000,000.00",
    "release": "2023",
    "height_cm": "160",
    "weight_kg": "30",
    "walk_kmh": "4",
    "run_kmh": "12",
    "payload_kg": "20",
    "power_hours": "2-4",
    "software": "",
    "voice": "",
    "clothed": "Yes",
    "id": "1x-neo"
  },
  {
    "company": "AeiROBOT",
    "robot": "Alice",
    "website": "https://eng.arobot4all.com/",
    "x": "",
    "linkedin": "",
    "youtube": "",
    "country": "South Korea",
    "careers": "",
    "b2b_client": "",
    "stock": "Private",
    "valuation": "",
    "investors": "",
    "rounds": "",
    "release": "",
    "height_cm": "136",
    "weight_kg": "20",
    "walk_kmh": "",
    "run_kmh": "",
    "payload_kg": "",
    "power_hours": "",
    "software": "AI-based autonomous soccer robot",
    "voice": "",
    "clothed": "Yes",
    "id": "aeirobot-alice"
  },
  {
    "company": "Aeolus",
    "robot": "aeo",
    "website": "https://aeolusbot.com/",
    "x": "",
    "linkedin": "https://www.linkedin.com/company/aeolusrobotics/",
    "youtube": "https://www.youtube.com/watch?v=c_T-mRX4e4A",
    "country": "USA",
    "careers": "https://aeolusbot.com/about#careers",
    "b2b_client": "",
    "stock": "Private",
    "valuation": "",
    "investors": "",
    "rounds": "",
    "release": "",
    "height_cm": "",
    "weight_kg": "",
    "walk_kmh": "",
    "run_kmh": "",
    "payload_kg": "",
    "power_hours": "",
    "software": "",
    "voice": "",
    "clothed": "",
    "id": "aeolus-aeo"
  },
  {
    "company": "Agibot",
    "robot": "XI",
    "website": "https://www.agibot.com/",
    "x": "https://x.com/AgiBot_zhiyuan",
    "linkedin": "https://www.linkedin.com/company/agibot/",
    "youtube": "https://www.youtube.com/watch?v=DQHGV3hrnL0",
    "country": "China",
    "careers": "",
    "b2b_client": "",
    "stock": "Private",
    "valuation": "",
    "investors": "",
    "rounds": "",
    "release": "",
    "height_cm": "130",
    "weight_kg": "33",
    "walk_kmh": "",
    "run_kmh": "",
    "payload_kg": "",
    "power_hours": "",
    "software": "",
    "voice": "",
    "clothed": "No",
    "id": "agibot-xi"
  },
  {
    "company": "Agile",
    "robot": "One",
    "website": "https://www.agile-robots.com/",
    "x": "",
    "linkedin": "https://www.linkedin.com/company/agile-robots-se/",
    "youtube": "https://www.youtube.com/@Agile_Robots",
    "country": "Germany",
    "careers": "",
    "b2b_client": "",
    "stock": "Private",
    "valuation": "",
    "investors": "",
    "rounds": "",
    "release": "2026",
    "height_cm": "174",
    "weight_kg": "69",
    "walk_kmh": "",
    "run_kmh": "",
    "payload_kg": "",
    "power_hours": "",
    "software": "",
    "voice": "",
    "clothed": "No",
    "id": "agile-one"
  },
  {
    "company": "Agility",
    "robot": "Digit",
    "website": "https://agilityrobotics.com/robots",
    "x": "https://x.com/agilityrobotics",
    "linkedin": "https://www.linkedin.com/company/agilityrobotics/",
    "youtube": "https://youtu.be/rnFZAB9ogEE",
    "country": "USA",
    "careers": "",
    "b2b_client": "",
    "stock": "Private",
    "valuation": "",
    "investors": "NVIDIA, Sony",
    "rounds": "",
    "release": "2023",
    "height_cm": "175",
    "weight_kg": "64",
    "walk_kmh": "5.4",
    "run_kmh": "5.4",
    "payload_kg": "16",
    "power_hours": "3",
    "software": "",
    "voice": "",
    "clothed": "No",
    "id": "agility-digit"
  },
  {
    "company": "Apptronik",
    "robot": "Apollo",
    "website": "https://apptronik.com/product-page",
    "x": "https://x.com/apptronik",
    "linkedin": "https://www.linkedin.com/company/apptronik-inc./",
    "youtube": "https://youtu.be/pymvNott6nw",
    "country": "USA",
    "careers": "https://apptronik.com/careers",
    "b2b_client": "Mercedes Benz, GXO",
    "stock": "Private",
    "valuation": "",
    "investors": "Google, Mercedes Benz, ARK",
    "rounds": "",
    "release": "2023",
    "height_cm": "172",
    "weight_kg": "72",
    "walk_kmh": "",
    "run_kmh": "",
    "payload_kg": "25",
    "power_hours": "4",
    "software": "Apptronik autonomy stack; hot-swappable battery platform",
    "voice": "",
    "clothed": "No",
    "id": "apptronik-apollo"
  },
  {
    "company": "Argon",
    "robot": "One",
    "website": "https://www.argonmech.com/",
    "x": "",
    "linkedin": "",
    "youtube": "",
    "country": "",
    "careers": "",
    "b2b_client": "",
    "stock": "Private",
    "valuation": "",
    "investors": "",
    "rounds": "",
    "release": "",
    "height_cm": "",
    "weight_kg": "",
    "walk_kmh": "",
    "run_kmh": "",
    "payload_kg": "",
    "power_hours": "",
    "software": "",
    "voice": "",
    "clothed": "",
    "id": "argon-one"
  },
  {
    "company": "ARX",
    "robot": "X7",
    "website": "https://arx-x.com/",
    "x": "https://x.com/ARX_Zhang",
    "linkedin": "",
    "youtube": "https://www.youtube.com/watch?v=eDhTXj8ChKg",
    "country": "China",
    "careers": "",
    "b2b_client": "",
    "stock": "Private",
    "valuation": "",
    "investors": "",
    "rounds": "",
    "release": "",
    "height_cm": "",
    "weight_kg": "",
    "walk_kmh": "",
    "run_kmh": "",
    "payload_kg": "",
    "power_hours": "",
    "software": "",
    "voice": "",
    "clothed": "",
    "id": "arx-x7"
  },
  {
    "company": "Astribot",
    "robot": "S1",
    "website": "https://astribot.com/",
    "x": "https://x.com/Astribot_Inc",
    "linkedin": "",
    "youtube": "https://youtu.be/6X-s4Qsn1z4",
    "country": "China",
    "careers": "",
    "b2b_client": "",
    "stock": "Private",
    "valuation": "",
    "investors": "",
    "rounds": "",
    "release": "2024",
    "height_cm": "165",
    "weight_kg": "58",
    "walk_kmh": "",
    "run_kmh": "36",
    "payload_kg": "10",
    "power_hours": "",
    "software": "",
    "voice": "",
    "clothed": "No",
    "id": "astribot-s1"
  },
  {
    "company": "Beyond Imagination",
    "robot": "Beomni",
    "website": "https://www.beomni.ai/",
    "x": "",
    "linkedin": "",
    "youtube": "",
    "country": "",
    "careers": "",
    "b2b_client": "",
    "stock": "Private",
    "valuation": "",
    "investors": "",
    "rounds": "",
    "release": "",
    "height_cm": "",
    "weight_kg": "",
    "walk_kmh": "",
    "run_kmh": "",
    "payload_kg": "",
    "power_hours": "",
    "software": "",
    "voice": "",
    "clothed": "",
    "id": "beyond-imagination-beomni"
  },
  {
    "company": "Boardwalk",
    "robot": "Alex",
    "website": "https://boardwalkrobotics.com/",
    "x": "https://x.com/boardwalkrobot",
    "linkedin": "https://www.linkedin.com/company/boardwalk-robotics/",
    "youtube": "https://www.youtube.com/watch?v=tD3FNZUG2kQ",
    "country": "USA",
    "careers": "https://www.boardwalkrobotics.com/Careers",
    "b2b_client": "",
    "stock": "Private",
    "valuation": "",
    "investors": "",
    "rounds": "",
    "release": "",
    "height_cm": "",
    "weight_kg": "",
    "walk_kmh": "",
    "run_kmh": "",
    "payload_kg": "",
    "power_hours": "",
    "software": "",
    "voice": "",
    "clothed": "",
    "id": "boardwalk-alex"
  },
  {
    "company": "Booster",
    "robot": "T1",
    "website": "https://www.boosterobotics.com/",
    "x": "https://x.com/boosterobotics",
    "linkedin": "https://www.linkedin.com/company/booster-robotics/",
    "youtube": "https://www.youtube.com/watch?v=djUWG9Xqaq4",
    "country": "China",
    "careers": "",
    "b2b_client": "Developers, researchers, robotics competitions",
    "stock": "Private",
    "valuation": "",
    "investors": "",
    "rounds": "",
    "release": "2024",
    "height_cm": "118",
    "weight_kg": "30",
    "walk_kmh": "1.8",
    "run_kmh": "4.3",
    "payload_kg": "5",
    "power_hours": "1.5-2 walking / 4 standing",
    "software": "Open-source developer platform; Booster SDK",
    "voice": "",
    "clothed": "No",
    "id": "booster-t1"
  },
  {
    "company": "Borg",
    "robot": "Borg 01",
    "website": "https://www.borgrobotic.com/",
    "x": "https://x.com/borgrobotic",
    "linkedin": "https://www.linkedin.com/company/borgrobotics/",
    "youtube": "https://www.youtube.com/watch?v=r7TXGU3CxPg",
    "country": "USA",
    "careers": "",
    "b2b_client": "Manufacturing, warehousing, logistics",
    "stock": "Private",
    "valuation": "",
    "investors": "",
    "rounds": "",
    "release": "2025",
    "height_cm": "173",
    "weight_kg": "62",
    "walk_kmh": "",
    "run_kmh": "",
    "payload_kg": "12",
    "power_hours": "",
    "software": "Modular industrial humanoid; adaptive gait AI",
    "voice": "",
    "clothed": "No",
    "id": "borg-borg-01"
  },
  {
    "company": "Boston Dynamics",
    "robot": "Atlas",
    "website": "https://www.bostondynamics.com/atlas",
    "x": "https://x.com/BostonDynamics",
    "linkedin": "https://www.linkedin.com/company/boston-dynamics/",
    "youtube": "https://youtu.be/-e1_QhJ1EhQ",
    "country": "USA",
    "careers": "",
    "b2b_client": "",
    "stock": "Private",
    "valuation": "",
    "investors": "",
    "rounds": "37,000,000.00",
    "release": "2022",
    "height_cm": "150",
    "weight_kg": "89",
    "walk_kmh": "9",
    "run_kmh": "9",
    "payload_kg": "11",
    "power_hours": "",
    "software": "",
    "voice": "",
    "clothed": "No",
    "id": "boston-dynamics-atlas"
  },
  {
    "company": "Cartwheel",
    "robot": "Yogi",
    "website": "https://www.cartwheelrobotics.com/",
    "x": "",
    "linkedin": "https://www.linkedin.com/company/cartwheel-robotics/",
    "youtube": "",
    "country": "USA",
    "careers": "",
    "b2b_client": "",
    "stock": "Private",